{
  "schema_version": "1.0",
  "name": "sin_demo_v1",
  "description": "Illustrative silicon-nitride process for exercising the EDA flow. Not a foundry PDK; geometry rules are demonstration values and compact models are uncalibrated unless a source says otherwise.",
  "foundry": null,
  "database_unit_um": 0.001,
  "layers": {
    "core": [1, 0],
    "heater": [2, 0]
  },
  "rules": {
    "minimum_width_um": 0.5,
    "minimum_spacing_um": 0.5,
    "bend_radius_um": 50
  },
  "materials": {
    "silicon_nitride": {
      "model": "sellmeier",
      "terms": [
        { "b": 3.0249, "c_um": 0.1353406 },
        { "b": 40314, "c_um": 1239.842 }
      ],
      "validity_wavelength_um": [0.31, 5.504],
      "source": {
        "kind": "literature",
        "reference": "K. Luke et al., Broadband mid-infrared frequency comb generation in a Si3N4 microresonator, Opt. Lett. 40, 4823 (2015): LPCVD Si3N4 Sellmeier fit",
        "calibrated": false,
        "evidence": null
      }
    },
    "silicon_dioxide": {
      "model": "sellmeier",
      "terms": [
        { "b": 0.6961663, "c_um": 0.0684043 },
        { "b": 0.4079426, "c_um": 0.1162414 },
        { "b": 0.8974794, "c_um": 9.896161 }
      ],
      "validity_wavelength_um": [0.21, 6.7],
      "source": {
        "kind": "literature",
        "reference": "I. H. Malitson, Interspecimen comparison of the refractive index of fused silica, J. Opt. Soc. Am. 55, 1205 (1965)",
        "calibrated": false,
        "evidence": null
      }
    }
  },
  "cross_sections": {
    "strip": {
      "layer": "core",
      "width_um": 1,
      "thickness_um": 0.4,
      "core_material": "silicon_nitride",
      "cladding_material": "silicon_dioxide",
      "mode": {
        "reference_wavelength_um": 1.55,
        "effective_index": 1.8,
        "group_index": 1.9,
        "loss_db_per_cm": 0,
        "source": {
          "kind": "assumption",
          "reference": "Illustrative indices chosen to exercise the flow; not derived from this cross-section or measured.",
          "calibrated": false,
          "evidence": null
        }
      }
    },
    "heater": {
      "layer": "heater",
      "width_um": 2.5
    }
  },
  "components": {
    "ideal_coupler": {
      "ports": [
        { "name": "o1", "domain": "optical", "position_um": [-10, -1.25], "orientation_deg": 180 },
        { "name": "o2", "domain": "optical", "position_um": [-10, 1.25], "orientation_deg": 180 },
        { "name": "o3", "domain": "optical", "position_um": [50, 1.25], "orientation_deg": 0 },
        { "name": "o4", "domain": "optical", "position_um": [50, -1.25], "orientation_deg": 0 }
      ],
      "cell": {
        "factory": "mmi2x2",
        "cross_section": "strip",
        "settings": {
          "width_taper": 1.5,
          "length_taper": 10,
          "length_mmi": 40,
          "width_mmi": 5,
          "gap_mmi": 1
        }
      },
      "model": { "name": "ideal_coupler", "version": "ideal_coupler_v1" },
      "validity": {
        "wavelength_um": [1.45, 1.65],
        "parameters": { "coupling_ratio": [0, 1] }
      },
      "source": {
        "kind": "assumption",
        "reference": "Ideal reciprocal coupler with a prescribed power ratio and zero delay; the MMI polygon is not calibrated to any ratio.",
        "calibrated": false,
        "evidence": null
      }
    },
    "waveguide": {
      "ports": [
        { "name": "o1", "domain": "optical" },
        { "name": "o2", "domain": "optical" }
      ],
      "cell": { "factory": "extrusion", "cross_section": "strip" },
      "model": { "name": "waveguide", "version": "ideal_sin_waveguide_v1" },
      "validity": {
        "wavelength_um": [1.45, 1.65],
        "parameters": { "length_um": [0, 100000] }
      },
      "source": {
        "kind": "assumption",
        "reference": "Linear dispersion around the strip cross-section mode model; bend loss and bend phase omitted.",
        "calibrated": false,
        "evidence": null
      }
    },
    "phase_shifter": {
      "ports": [
        { "name": "o1", "domain": "optical" },
        { "name": "o2", "domain": "optical" },
        { "name": "e1", "domain": "electrical" },
        { "name": "e2", "domain": "electrical" }
      ],
      "cell": {
        "factory": "extrusion",
        "cross_section": "strip",
        "actuator_cross_section": "heater"
      },
      "model": { "name": "phase_shifter", "version": "ideal_phase_shifter_v1" },
      "validity": {
        "wavelength_um": [1.45, 1.65],
        "parameters": {
          "length_um": [0, 100000],
          "phase_rad": [-12.566370614359172, 12.566370614359172],
          "active_length_um": [20, 200]
        }
      },
      "source": {
        "kind": "assumption",
        "reference": "Commanded optical phase at the reference wavelength; no electrical-to-phase calibration.",
        "calibrated": false,
        "evidence": null
      }
    }
  }
}
